{
  "metadata": {
    "schema_version": "1.1",
    "generated_at": "2026-05-21T07:04:11.793446+00:00",
    "season": "2025-26",
    "status": "ACTIVE",
    "model_version": "5.1",
    "games_count": 1,
    "picks_found": 1,
    "data_quality": {
      "cache_used": false,
      "bref_available": true,
      "bdl_available": true,
      "teams_with_missing_stats": [
        "ATL",
        "BKN",
        "BOS",
        "CHA",
        "CHI",
        "CLE",
        "DAL",
        "DEN",
        "DET",
        "GSW",
        "HOU",
        "IND",
        "LAC",
        "LAL",
        "MEM",
        "MIA",
        "MIL",
        "MIN",
        "NOP",
        "NYK",
        "OKC",
        "ORL",
        "PHI",
        "PHX",
        "POR",
        "SAC",
        "SAS",
        "TOR",
        "UTA",
        "WAS"
      ]
    },
    "pipeline_warnings": [
      "Some teams have incomplete model input stats."
    ]
  },
  "games": [
    {
      "id": "21713897",
      "start_time": "2026-05-22T00:00:00.000Z",
      "status": "SCHEDULED",
      "home": {
        "team_id": 1610612752,
        "abbr": "NYK",
        "name": "New York Knicks"
      },
      "away": {
        "team_id": 1610612739,
        "abbr": "CLE",
        "name": "Cleveland Cavaliers"
      },
      "prediction": {
        "home_win_prob": 0.8049,
        "away_win_prob": 0.1951,
        "predicted_spread": 4.0,
        "confidence": "HIGH"
      }
    }
  ],
  "picks": {
    "date": "2026-05-21",
    "lock": {
      "game_id": "21713897",
      "away_abbr": "CLE",
      "home_abbr": "NYK",
      "selection": "NYK",
      "win_prob": 0.8049,
      "confidence": "HIGH",
      "start_time": "2026-05-22T00:00:00.000Z"
    },
    "premium": []
  },
  "history": {
    "past_slips": [
      {
        "date": "2026-05-19",
        "backfilled": true,
        "lock": {
          "game_id": "21713895",
          "away_abbr": "CLE",
          "home_abbr": "NYK",
          "selection": "NYK",
          "win_prob": 0.8049,
          "confidence": "HIGH",
          "status": "WIN",
          "start_time": "2026-05-20T00:00:00.000Z"
        },
        "premium": []
      }
    ],
    "backfilled_dates": [
      "2026-05-19"
    ]
  }
}